{
    "$schema": "http://json-schema.org/draft-07/schema#",
    "$id": "https://api.whitepointsurvey.com/schemas/jobPosition.json",
    "title": "JobPosition",
    "type": "object",
    "properties": {
        "id": {
            "type": "string",
            "description": "Unique identifier for the job position",
            "example": "01-0001, SUR-1001, ENG-2002A",
            "pattern": "^[A-Z0-9]{2,3}-\\d{4}[A-Z]?$"
        },
        "displayName": {
            "type": "string",
            "description": "Human-readable name for the job position",
            "example": "Software Engineer I, Senior Data Analyst, Marketing Manager"
        },
        "isActive": {
            "type": "boolean",
            "description": "Is this position currently active and accepting applications?",
            "default": true
        },
        "basicInfo": {
            "type": "object",
            "description": "basic information relating to the position",
            "properties": {
                "positionOpenDate": {
                    "type": "string",
                    "description": "The date the position is supposed to open.",
                    "example": "2026-07-01 for July 1, 2026",
                    "pattern": "^\\d{4}-\\d{2}-\\d{2}$"
                },
                "positionEndDate": {
                    "type": "string",
                    "description": "The date the position is supposed to close. If no end date is selected, enter 0",
                    "examples": [
                        "2026-08-01 for July 1, 2026.",
                        "0 for no closing date"
                    ],
                    "pattern": "^20\\d{2}-\\d{2}-\\d{2}$|^0$"
                },
                "positionSalaryType": {
                    "type": "string",
                    "description": "What is the salary type of the position",
                    "enum": [
                        "Full-Time Salary",
                        "Full-Time Hourly",
                        "Part-Time Hourly",
                        "Seasonal",
                        "Internship"
                    ]
                },
                "startingSalary": {
                    "type": "integer",
                    "description": "What is the lowest salary offered for this position. For hourly positions, post the per-hour compensation. For salary positions, post the yearly compensation.",
                    "default": 15.00,
                    "minimum": 15.00
                },
                "endingSalary": {
                    "type": "integer",
                    "description": "What is the highest salary offered for this position. For hourly positions, post the per-hour compensation. For salary positions, post the yearly compensation.",
                    "default": 15.00,
                    "minimum": 15.00
                },
                "positionCity": {
                    "type": "string",
                    "description": "Where is the position located? For remote positions, enter 'Remote'. For hybrid positions, enter the primary location (e.g., 'New York, NY')."
                },
                "positionState": {
                    "type": "string",
                    "description": "What state is the position being offered in? For remote positions, state where the company is headquartered.",
                    "enum": [
                        "AL",
                        "AK",
                        "AZ",
                        "AR",
                        "CA",
                        "CO",
                        "CT",
                        "DE",
                        "FL",
                        "GA",
                        "HI",
                        "ID",
                        "IL",
                        "IN",
                        "IA",
                        "KS",
                        "KY",
                        "LA",
                        "ME",
                        "MD",
                        "MA",
                        "MI",
                        "MN",
                        "MS",
                        "MO",
                        "MT",
                        "NE",
                        "NV",
                        "NH",
                        "NJ",
                        "NM",
                        "NY",
                        "NC",
                        "ND",
                        "OH",
                        "OK",
                        "OR",
                        "PA",
                        "RI",
                        "SC",
                        "SD",
                        "TN",
                        "TX",
                        "UT",
                        "VT",
                        "VA",
                        "WA",
                        "WV",
                        "WI",
                        "WY"
                    ]
                },
                "positionType": {
                    "type": "string",
                    "description": "What is the type of position offered?",
                    "enum": [
                        "Office",
                        "Field",
                        "Remote",
                        "Hybrid Office / Field",
                        "Hybrid Office / Remote"
                    ]
                },
                "department": {
                    "type": "string",
                    "description": "What department is this position in? This can be used for internal categorization and filtering but is not required to be displayed on the front-end.",
                    "example": "Engineering, Marketing, Sales, Human Resources"
                }
            },
            "required": [
                "positionOpenDate",
                "positionEndDate",
                "positionSalaryType",
                "startingSalary",
                "positionCity",
                "positionState",
                "positionType",
                "department"
            ]
        },
        "description": {
            "type": "array",
            "description": "A detailed description of the job position, including responsibilities, qualifications, and any other relevant information.",
            "items": {
                "type": "object",
                "description": "A single item in the job description. This can be a paragraph, list-bulleted, or list-numbered item.",
                "properties": {
                    "type": {
                        "type": "string",
                        "description": "The type of description item.",
                        "enum": [
                            "paragraph",
                            "list-bulleted",
                            "list-numbered"
                        ]
                    },
                    "content": {
                        "type": "string",
                        "description": "The content of the description item. For 'paragraph' type, this should be a single string. For 'list' type, this should be a string with items separated by newlines."
                    }
                }
            },
            "example": [
                {
                    "type": "paragraph",
                    "content": "We are seeking a skilled CAD Technician to join our team. The ideal candidate will have experience in creating detailed technical drawings and plans using computer-aided design (CAD) software. The CAD Technician will work closely with engineers and architects to produce accurate and high-quality designs for various projects."
                },
                {
                    "type": "paragraph",
                    "content": "Responsibilities include interpreting technical drawings, creating 3D models, and collaborating with project teams to ensure designs meet specifications. The successful candidate will have strong attention to detail, excellent communication skills, and the ability to work in a fast-paced environment."
                }
            ]
        },
        "benefits": {
            "type": "array",
            "description": "A list of benefits offered for this position.",
            "items": {
                "type": "string",
                "description": "A single benefit offered for this position."
            },
            "example": [
                "Health insurance",
                "401(k) with company match",
                "Paid time off",
                "Remote work options"
            ]
        },
        "requirements": {
            "type": "array",
            "description": "A list of requirements for this position.",
            "items": {
                "type": "string",
                "description": "A single requirement for this position."
            },
            "example": [
                "Bachelor's degree in Computer Science or related field",
                "3+ years of experience in software development",
                "Proficiency in JavaScript and React",
                "Excellent problem-solving skills"
            ]
        },
        "meta": {
            "type": "object",
            "description": "Additional metadata about the job position that is used in back-end systems but not displayed on the front-end. This can include information such as internal notes, tags for categorization, or any other relevant data that should not be exposed to the public.",
            "properties": {
                "tags": {
                    "type": "array",
                    "description": "Internal tags for categorizing the job position.",
                    "items": {
                        "type": "string",
                        "description": "A single tag for categorizing the job position."
                    },
                    "example": [
                        "engineering",
                        "remote",
                        "full-time"
                    ]
                },
                "submissionType": {
                    "type": "string",
                    "description": "The type of submission for this position. This can be used to determine how applications are processed (e.g., through an ATS, via email, etc.).",
                    "enum": [
                        "Email",
                        "ATS"
                    ],
                    "default": "Email"
                },
                "submissionSettings": {
                    "type": "object",
                    "description": "Settings used for the selected submission type."
                },
                "requireResumeUpload": {
                    "type": "boolean",
                    "description": "Indicates whether applicants are required to upload a resume when applying for this position.",
                    "default": true
                },
                "requireCoverLetter": {
                    "type": "boolean",
                    "description": "Indicates whether applicants are required to upload a cover letter when applying for this position.",
                    "default": false
                }
            },
            "allOf": [
                {
                    "if": {
                        "required": [
                            "submissionType"
                        ],
                        "properties": {
                            "submissionType": {
                                "const": "Email"
                            }
                        }
                    },
                    "then": {
                        "properties": {
                            "submissionSettings": {
                                "type": "object",
                                "description": "Settings for email submissions, if applicable.",
                                "properties": {
                                    "recipientEmail": {
                                        "type": "array",
                                        "items": {
                                            "type": "string",
                                            "format": "email"
                                        },
                                        "description": "The email address to which applications should be sent.",
                                        "example": ["test@test.com"]
                                    }
                                },
                                "required": [
                                    "recipientEmail"
                                ]
                            }
                        }
                    },
                    "else": {
                        "properties": {
                            "submissionSettings": {
                                "type": "object",
                                "description": "Settings for ATS submissions, if applicable.",
                                "properties": {
                                    "atsUrl": {
                                        "type": "string",
                                        "description": "The URL of the Applicant Tracking System (ATS) where applications should be submitted.",
                                        "format": "uri",
                                        "example": "https://company.ats.com/job/12345"
                                    }
                                },
                                "required": [
                                    "atsUrl"
                                ]
                            }
                        }
                    }
                }
            ],
            "required": [
                "tags",
                "submissionType",
                "submissionSettings",
                "requireResumeUpload",
                "requireCoverLetter"
            ]
        }
    },
    "required": [
        "id",
        "displayName",
        "isActive",
        "basicInfo",
        "description",
        "benefits",
        "requirements",
        "meta"
    ]
}